{
 "meta": {
  "built_by": "build_passage_questions.py",
  "provenance": {
   "cloze_real": [
    "HN2026_L14_cloze",
    "HN2026_L15_cloze",
    "HN2026_L16_cloze",
    "HN2026_L17_cloze",
    "HN2026_L18_cloze",
    "HN2026_L19_cloze",
    "HN2026_L20_cloze",
    "HN2026_L6_cloze",
    "HN2026_L8_cloze"
   ],
   "cloze_adapted": [
    "HN2026_L13_cloze",
    "HN2026_L1_cloze",
    "HN2026_L2_cloze",
    "HN2026_L3_cloze",
    "HN2026_L4_cloze"
   ],
   "w5_adapted": [
    "HN2026_L1_w5",
    "HN2026_L6_w5",
    "HN2026_L8_w5"
   ]
  }
 },
 "reading": {
  "HN2026_L6_reading_a": [
   {
    "num": 1,
    "q": "What does Lily have for breakfast?",
    "opts": [
     [
      "A",
      "milk and bread"
     ],
     [
      "B",
      "rice and vegetables"
     ],
     [
      "C",
      "apples and bananas"
     ]
    ],
    "answer": "A"
   },
   {
    "num": 2,
    "q": "Where does Lily eat lunch?",
    "opts": [
     [
      "A",
      "at home"
     ],
     [
      "B",
      "at school"
     ],
     [
      "C",
      "in a restaurant"
     ]
    ],
    "answer": "B"
   },
   {
    "num": 3,
    "q": "What do Lily's family eat for dinner?",
    "opts": [
     [
      "A",
      "rice and chicken"
     ],
     [
      "B",
      "bread and milk"
     ],
     [
      "C",
      "apples, bananas and oranges"
     ]
    ],
    "answer": "C"
   },
   {
    "num": 4,
    "q": "Why does Lily NOT like fast food?",
    "opts": [
     [
      "A",
      "Because it is not good"
     ],
     [
      "B",
      "Because it is too expensive"
     ],
     [
      "C",
      "Because it is too sweet"
     ]
    ],
    "answer": "A"
   },
   {
    "num": 5,
    "q": "What helps Lily grow tall and strong?",
    "opts": [
     [
      "A",
      "Fast food and cola"
     ],
     [
      "B",
      "Fruit and milk"
     ],
     [
      "C",
      "Candy and cakes"
     ]
    ],
    "answer": "B"
   }
  ],
  "HN2026_L8_reading_a": [
   {
    "num": 1,
    "q": "When did the family go on the trip?",
    "opts": [
     [
      "A",
      "yesterday"
     ],
     [
      "B",
      "today"
     ],
     [
      "C",
      "tomorrow"
     ]
    ],
    "answer": "A"
   },
   {
    "num": 2,
    "q": "What did the writer pack in the morning?",
    "opts": [
     [
      "A",
      "food and water"
     ],
     [
      "B",
      "clothes"
     ],
     [
      "C",
      "a postcard"
     ]
    ],
    "answer": "B"
   },
   {
    "num": 3,
    "q": "How was the weather that day?",
    "opts": [
     [
      "A",
      "cold and rainy"
     ],
     [
      "B",
      "windy and dark"
     ],
     [
      "C",
      "sunny and warm"
     ]
    ],
    "answer": "C"
   },
   {
    "num": 4,
    "q": "What time did the trip start?",
    "opts": [
     [
      "A",
      "at 8 a.m."
     ],
     [
      "B",
      "at 6 p.m."
     ],
     [
      "C",
      "at 9 a.m."
     ]
    ],
    "answer": "A"
   },
   {
    "num": 5,
    "q": "What did the writer buy for a friend?",
    "opts": [
     [
      "A",
      "a map"
     ],
     [
      "B",
      "a postcard"
     ],
     [
      "C",
      "a camera"
     ]
    ],
    "answer": "B"
   }
  ],
  "HN2026_L2_reading_a": [
   {
    "num": 1,
    "q": "What is the passage mainly about?",
    "opts": [
     [
      "A",
      "a family photo album"
     ],
     [
      "B",
      "a school show"
     ],
     [
      "C",
      "a birthday party"
     ]
    ],
    "answer": "A"
   },
   {
    "num": 2,
    "q": "Who can you see in the first picture?",
    "opts": [
     [
      "A",
      "father and mother"
     ],
     [
      "B",
      "grandpa and grandma"
     ],
     [
      "C",
      "my cousin"
     ]
    ],
    "answer": "B"
   },
   {
    "num": 3,
    "q": "Who is the little boy in the picture?",
    "opts": [
     [
      "A",
      "my brother"
     ],
     [
      "B",
      "my friend"
     ],
     [
      "C",
      "my cousin"
     ]
    ],
    "answer": "C"
   },
   {
    "num": 4,
    "q": "How is the family?",
    "opts": [
     [
      "A",
      "happy"
     ],
     [
      "B",
      "sad"
     ],
     [
      "C",
      "busy"
     ]
    ],
    "answer": "A"
   },
   {
    "num": 5,
    "q": "The passage may be from ______.",
    "opts": [
     [
      "A",
      "a diary"
     ],
     [
      "B",
      "a class show"
     ],
     [
      "C",
      "a letter"
     ]
    ],
    "answer": "B"
   }
  ],
  "HN2026_L3_reading_a": [
   {
    "num": 1,
    "q": "Where were the things found this week?",
    "opts": [
     [
      "A",
      "in the school library"
     ],
     [
      "B",
      "in the classroom"
     ],
     [
      "C",
      "in the park"
     ]
    ],
    "answer": "A"
   },
   {
    "num": 2,
    "q": "When was the white eraser found?",
    "opts": [
     [
      "A",
      "on Monday"
     ],
     [
      "B",
      "on Tuesday"
     ],
     [
      "C",
      "on Wednesday"
     ]
    ],
    "answer": "B"
   },
   {
    "num": 3,
    "q": "What is in the blue pencil box?",
    "opts": [
     [
      "A",
      "a cat picture"
     ],
     [
      "B",
      "a red cover"
     ],
     [
      "C",
      "two pens and a ruler"
     ]
    ],
    "answer": "C"
   },
   {
    "num": 4,
    "q": "What must you do before taking a thing?",
    "opts": [
     [
      "A",
      "describe your thing"
     ],
     [
      "B",
      "pay some money"
     ],
     [
      "C",
      "call your teacher"
     ]
    ],
    "answer": "A"
   },
   {
    "num": 5,
    "q": "What does the English dictionary have?",
    "opts": [
     [
      "A",
      "a white eraser"
     ],
     [
      "B",
      "a red cover"
     ],
     [
      "C",
      "a blue pencil box"
     ]
    ],
    "answer": "B"
   }
  ],
  "HN2026_L13_reading_a": [
   {
    "num": 1,
    "q": "When is the big weekend sale?",
    "opts": [
     [
      "A",
      "from Friday to Sunday"
     ],
     [
      "B",
      "from Monday to Friday"
     ],
     [
      "C",
      "every weekend in June"
     ]
    ],
    "answer": "A"
   },
   {
    "num": 2,
    "q": "How much is the discount on fresh fruit before 9 a.m.?",
    "opts": [
     [
      "A",
      "ten percent off"
     ],
     [
      "B",
      "twenty percent off"
     ],
     [
      "C",
      "thirty percent off"
     ]
    ],
    "answer": "B"
   },
   {
    "num": 3,
    "q": "What is the special deal on milk, bread and eggs?",
    "opts": [
     [
      "A",
      "twenty percent off"
     ],
     [
      "B",
      "buy one, get one free"
     ],
     [
      "C",
      "buy two, get one free"
     ]
    ],
    "answer": "C"
   },
   {
    "num": 4,
    "q": "What do you get if you spend over fifty yuan?",
    "opts": [
     [
      "A",
      "a free package of salt"
     ],
     [
      "B",
      "a free bag"
     ],
     [
      "C",
      "a free package of sugar"
     ]
    ],
    "answer": "A"
   },
   {
    "num": 5,
    "q": "When is the supermarket open every day?",
    "opts": [
     [
      "A",
      "from 9 a.m. to 5 p.m."
     ],
     [
      "B",
      "from 8 a.m. to 10 p.m."
     ],
     [
      "C",
      "from 8 a.m. to 8 p.m."
     ]
    ],
    "answer": "B"
   }
  ],
  "HN2026_L14_reading_a": [
   {
    "num": 1,
    "q": "Who is the writer's favorite teacher?",
    "opts": [
     [
      "A",
      "Mr. Lee"
     ],
     [
      "B",
      "Mr. Brown"
     ],
     [
      "C",
      "Miss Li"
     ]
    ],
    "answer": "A"
   },
   {
    "num": 2,
    "q": "What does Mr. Lee look like?",
    "opts": [
     [
      "A",
      "short and thin"
     ],
     [
      "B",
      "tall and thin"
     ],
     [
      "C",
      "tall and fat"
     ]
    ],
    "answer": "B"
   },
   {
    "num": 3,
    "q": "Why is Mr. Lee popular?",
    "opts": [
     [
      "A",
      "because he is strict"
     ],
     [
      "B",
      "because he is handsome"
     ],
     [
      "C",
      "because he is patient and funny"
     ]
    ],
    "answer": "C"
   },
   {
    "num": 4,
    "q": "How does Mr. Lee explain difficult ideas?",
    "opts": [
     [
      "A",
      "with easy examples"
     ],
     [
      "B",
      "with long sentences"
     ],
     [
      "C",
      "with pictures"
     ]
    ],
    "answer": "A"
   },
   {
    "num": 5,
    "q": "What does the writer want to be when he grows up?",
    "opts": [
     [
      "A",
      "a doctor"
     ],
     [
      "B",
      "a teacher like Mr. Lee"
     ],
     [
      "C",
      "a writer"
     ]
    ],
    "answer": "B"
   }
  ],
  "HN2026_L15_reading_a": [
   {
    "num": 1,
    "q": "When is the school trip to Green Mountain?",
    "opts": [
     [
      "A",
      "on Saturday"
     ],
     [
      "B",
      "on Sunday"
     ],
     [
      "C",
      "on Friday"
     ]
    ],
    "answer": "A"
   },
   {
    "num": 2,
    "q": "What is the weather like in the morning?",
    "opts": [
     [
      "A",
      "cloudy and cool"
     ],
     [
      "B",
      "sunny and warm"
     ],
     [
      "C",
      "rainy and cold"
     ]
    ],
    "answer": "B"
   },
   {
    "num": 3,
    "q": "What should students bring for the morning?",
    "opts": [
     [
      "A",
      "an umbrella"
     ],
     [
      "B",
      "comfortable shoes"
     ],
     [
      "C",
      "sunglasses and a hat"
     ]
    ],
    "answer": "C"
   },
   {
    "num": 4,
    "q": "When is there a chance of rain?",
    "opts": [
     [
      "A",
      "after 3:00 p.m."
     ],
     [
      "B",
      "in the morning"
     ],
     [
      "C",
      "at noon"
     ]
    ],
    "answer": "A"
   },
   {
    "num": 5,
    "q": "What should students wear for hiking?",
    "opts": [
     [
      "A",
      "new clothes"
     ],
     [
      "B",
      "comfortable shoes"
     ],
     [
      "C",
      "a coat"
     ]
    ],
    "answer": "B"
   }
  ],
  "HN2026_L16_reading_a": [
   {
    "num": 1,
    "q": "What is the passage mainly about?",
    "opts": [
     [
      "A",